data/processed/modeling/best_models.csv

location,target,model,mae,rmse,r2,n_train,n_test
austin,scent_daily,RidgeRegression,48.16103839326378,439.7740386330116,0.9998622932402377,876,219
dallas,north_daily,RidgeRegression,7.6376541535316465,68.70131183450737,0.9998543923497974,876,219
houston,coast_daily,LinearRegression,130.2707715878185,799.0534946220249,0.9997918034040895,876,219
san_antonio,scent_daily,LinearRegression,59.25535627751392,439.40617827723446,0.9998625235206388,876,219

README.md

### Austin

Dla Austin najlepszy wynik uzyskał model `RidgeRegression`, osiągając `RMSE = 439.77`, `MAE = 48.16` oraz `R² = 0.999862`.

### Dallas

Dla Dallas najlepszy wynik uzyskał model `RidgeRegression`, osiągając `RMSE = 68.70`, `MAE = 7.64` oraz `R² = 0.999854`.

### Houston

Dla Houston najlepszy wynik uzyskał model `LinearRegression`, osiągając `RMSE = 799.05`, `MAE = 130.27` oraz `R² = 0.999792`.

### San Antonio

Dla San Antonio najlepszy wynik uzyskał model `LinearRegression`, osiągając `RMSE = 439.41`, `MAE = 59.26` oraz `R² = 0.999863`.